{"payloadSchema": "chapter-plan.r2", "chapterId": "chapter:1", "compiledFromProjectRevision": 0, "compiledFromStateDigest": "aaaaaaaaaaaaaaaaaaaaaaaaaaaaaaaaaaaaaaaaaaaaaaaaaaaaaaaaaaaaaaaa", "contextManifestRef": {"artifactId": "context:1", "version": 1, "payloadHash": "aaaaaaaaaaaaaaaaaaaaaaaaaaaaaaaaaaaaaaaaaaaaaaaaaaaaaaaaaaaaaaaa"}, "chapterGoal": "goal", "activeTaskRefs": [], "continuityActions": [], "requiredStateOutcomes": [], "forbiddenTransitions": [], "knowledgeBoundaries": [], "reservationRefs": [], "horizonPreview": [], "craft": {"bigTurn": "货单是彭三的人调包的", "smallDiscovery": "老董也欠着彭三的钱", "protagonistWin": "林满当场揪出调包的货单", "device": {"name": "听旧物", "status": "NEW", "howUsed": "摸到货箱上的麻绳，听见调包人的声音"}, "warmth": "姑妈给他留了一碗面", "emotionalBeat": "他看见姑妈围裙上新补的一块", "situationChange": {"before": "只管记账", "after": "被彭三盯上"}, "scenes": [{"place": "江边码头", "people": [{"name": "林满", "wants": "要回货款", "hides": "自己也拿过回扣", "whyHere": "每天这时来对账"}, {"name": "老董", "wants": "要回货款", "hides": "自己也拿过回扣", "whyHere": "每天这时来对账"}], "conflict": "货单数目对不上", "events": ["老董交单", "林满发现少了两箱", "两人对账争执"], "readerQuestion": "货去哪了"}, {"place": "姑妈面馆", "people": [{"name": "林满", "wants": "要回货款", "hides": "自己也拿过回扣", "whyHere": "每天这时来对账"}, {"name": "老董", "wants": "要回货款", "hides": "自己也拿过回扣", "whyHere": "每天这时来对账"}], "conflict": "货单数目对不上", "events": ["老董交单", "林满发现少了两箱", "两人对账争执"], "readerQuestion": "货去哪了"}], "newLosses": ["前一天的记忆"], "endHook": "面馆门上贴了一张借据"}}
